<?xml version="1.0" encoding="UTF-8" ?>
<!DOCTYPE ComponentInfo SYSTEM "ComponentInfo.dtd">
<!-- WLS -->
<ComponentInfo>
  <Component ID="WLS" PROGRESS_UNITS="30" CHILD_OF="AS_COMMON">
      <ValidIf DBTYPE="ORACLE" /> 
      <Display NLS_ID="WLS_ID">WebLogic Services</Display>
      <RepositoryConfigFile>%RCU_HOME%/../oracle_common/common/sql/wlsservices/wlsservices.xml</RepositoryConfigFile>
      <DetectQuery>select owner from schema_version_registry where mr_type = 'WLS' and mrc_name = '%PREFIX_NAME%' and status in ('VALID','LOADED')</DetectQuery>
      <DetectQuery OPERATION='DATALOAD'>select owner from schema_version_registry where mr_type = 'WLS' and mrc_name = '%PREFIX_NAME%' and status = 'LOADED'</DetectQuery>
      <DetectQuery OPERATION='DROP'>select owner from schema_version_registry where mr_type = 'WLS' and mrc_name = '%PREFIX_NAME%'</DetectQuery>
      <SchemaUser>WLS</SchemaUser>
      <DatabaseName>WLS</DatabaseName>
      <Tablespaces>
        <Tablespace TYPE="DEFAULT_TABLESPACE">
           <Prompt NLS_ID="DEFAULT_TABLESPACE">WLS Services Default Tablespace</Prompt>
           <TablespaceName>WLS</TablespaceName>
        </Tablespace>
        <Tablespace TYPE="TEMPORARY_TABLESPACE">
           <Prompt NLS_ID="TEMPORARY_TABLESPACE">WLS Services Temporary Tablespace</Prompt>
           <TablespaceName>IAS_TEMP</TablespaceName>
        </Tablespace>
      </Tablespaces>
  </Component>
  <Component ID="WLS" PROGRESS_UNITS="30" CHILD_OF="AS_COMMON">
      <ValidIf DBTYPE="EBR" /> 
      <Display NLS_ID="WLS_ID">WebLogic Services</Display>
      <RepositoryConfigFile>%RCU_HOME%/../oracle_common/common/sql/wlsservices/wlsservices.xml</RepositoryConfigFile>
      <DetectQuery>select owner from schema_version_registry where mr_type = 'WLS' and mrc_name = '%PREFIX_NAME%' and status in ('VALID','LOADED')</DetectQuery>
      <DetectQuery OPERATION='DATALOAD'>select owner from schema_version_registry where mr_type = 'WLS' and mrc_name = '%PREFIX_NAME%' and status = 'LOADED'</DetectQuery>
      <DetectQuery OPERATION='DROP'>select owner from schema_version_registry where mr_type = 'WLS' and mrc_name = '%PREFIX_NAME%'</DetectQuery>
      <SchemaUser>WLS</SchemaUser>
      <DatabaseName>WLS</DatabaseName>
      <Tablespaces>
        <Tablespace TYPE="DEFAULT_TABLESPACE">
           <Prompt NLS_ID="DEFAULT_TABLESPACE">WLS Services Default Tablespace</Prompt>
           <TablespaceName>WLS</TablespaceName>
        </Tablespace>
        <Tablespace TYPE="TEMPORARY_TABLESPACE">
           <Prompt NLS_ID="TEMPORARY_TABLESPACE">WLS Services Temporary Tablespace</Prompt>
           <TablespaceName>IAS_TEMP</TablespaceName>
        </Tablespace>
      </Tablespaces>
  </Component>
  <Component ID="WLS" PROGRESS_UNITS="30" CHILD_OF="AS_COMMON">
      <ValidIf DBTYPE="SQLSERVER"/>
      <Display NLS_ID="WLS_ID">WebLogic Services</Display>
      <RepositoryConfigFile>%RCU_HOME%/../oracle_common/common/sql/wlsservices/wlsservices.xml</RepositoryConfigFile>
      <DetectQuery>select owner from schema_version_registry where mr_type = 'WLS' and mrc_name = '%PREFIX_NAME%' and status = 'VALID'</DetectQuery>
      <DetectQuery OPERATION='DROP'>select owner from schema_version_registry where mr_type = 'WLS' and mrc_name = '%PREFIX_NAME%'</DetectQuery>
      <SchemaUser>WLS</SchemaUser>
      <DatabaseName>WLS</DatabaseName>
  </Component>
  <Component ID="WLS" PROGRESS_UNITS="30" CHILD_OF="AS_COMMON">
      <ValidIf DBTYPE="IBMDB2"/>
      <Display NLS_ID="WLS_ID">WebLogic Services</Display>
      <RepositoryConfigFile>%RCU_HOME%/../oracle_common/common/sql/wlsservices/wlsservices.xml</RepositoryConfigFile>
      <DetectQuery>select owner from nullid.schema_version_registry where mr_type = 'WLS' and mrc_name = '%PREFIX_NAME%' and status = 'VALID'</DetectQuery>
      <DetectQuery OPERATION='DROP'>select owner from nullid.schema_version_registry where mr_type = 'WLS' and mrc_name = '%PREFIX_NAME%'</DetectQuery>
      <SchemaUser>WLS</SchemaUser>
      <DatabaseName>WLS</DatabaseName>
      <Tablespaces>
         <Tablespace TYPE="DEFAULT_TABLESPACE">
         <Prompt NLS_ID="DEFAULT_TABLESPACE">Default Tablespace</Prompt>
         <TablespaceName>WLS</TablespaceName>
      </Tablespace>
      <Tablespace TYPE="TEMPORARY_TABLESPACE">
         <Prompt NLS_ID="TEMPORARY_TABLESPACE">Temporary Tablespace</Prompt>
         <TablespaceName>IAS_TEMP</TablespaceName>
      </Tablespace>
    </Tablespaces>
  </Component>
  <Component ID="WLS" PROGRESS_UNITS="30" CHILD_OF="AS_COMMON">
      <ValidIf DBTYPE="MYSQL"/>
      <Display NLS_ID="WLS_ID">WebLogic Services</Display>
      <RepositoryConfigFile>%RCU_HOME%/../oracle_common/common/sql/wlsservices/wlsservices.xml</RepositoryConfigFile>
      <DetectQuery>select owner from schema_version_registry where mr_type = 'WLS' and mrc_name = '%PREFIX_NAME%' and status = 'VALID'</DetectQuery>
    <DetectQuery OPERATION='DROP'>select owner from schema_version_registry where mr_type = 'WLS' and mrc_name = '%PREFIX_NAME%'</DetectQuery>
      <SchemaUser>WLS</SchemaUser>
      <DatabaseName>WLS</DatabaseName>
  </Component>
</ComponentInfo>
<!-- End of WLS -->
